{
  "$schema": "https://json-schema.org/draft/2020-12/schema",
  "$id": "tenra-partition.lab-validation-result.v1",
  "title": "Partition lab validation result",
  "type": "object",
  "additionalProperties": true,
  "required": [
    "schema",
    "exportedAt",
    "sourceRequest",
    "reviewedPlan",
    "simulation",
    "review"
  ],
  "properties": {
    "schema": {
      "const": "tenra-partition.lab-validation-result.v1",
      "type": "string"
    },
    "exportedAt": {
      "type": "string"
    },
    "sourceRequest": {
      "type": "object"
    },
    "reviewedPlan": {
      "type": "object"
    },
    "simulation": {
      "type": "object"
    },
    "review": {
      "type": "object"
    }
  },
  "x-tenra": {
    "ownerApp": "partition",
    "producerApp": "partition",
    "consumerApps": [
      "guardrail"
    ],
    "fixture": "tenra Partition/fixtures/handoffs/lab-validation-result.json",
    "correlationFields": [
      "sourceRequest.id"
    ],
    "standardControls": [
      "schema badge",
      "preview payload",
      "blocked queue",
      "history"
    ]
  }
}
